{
  "schema_version": "ce-upstream-ledger-patch/v1",
  "unit_id": "U4",
  "base_ledger_sha256": "9f3b5d8d5b5026afe960874b41148ba80f7aa9da0b70f043fb7545a2dc4541ef",
  "base_target_source_snapshot": {
    "repository": "spec-first",
    "head": "b557f8bc6f884f0fef460108e6279b31227c50fb",
    "dirty": true,
    "dirty_paths": [
      "CHANGELOG.md",
      "docs/contracts/verification/verification-run-summary.md",
      "docs/contracts/workflows/honest-closeout.md",
      "docs/plans/2026-09-05-001-next-phase-optimization-program-plan.md",
      "docs/plans/2026-09-05-002-next-phase-development-sequence.md",
      "docs/plans/2026-09-07-001-sdlc-lens-multi-expert-improvement-plan.md",
      "docs/validation/skill-evals/next-phase-20260908/README.md",
      "docs/validation/skill-evals/next-phase-20260908/accounting-correction.md",
      "docs/validation/skill-evals/next-phase-20260908/autonomous-closeout.json",
      "docs/validation/skill-evals/next-phase-20260908/autonomous-closeout.md",
      "docs/validation/skill-evals/next-phase-20260908/installed-and-integration.json",
      "docs/validation/skill-evals/next-phase-20260908/installed-and-integration.md",
      "docs/validation/skill-evals/next-phase-20260908/missing-e03-r7.json",
      "docs/validation/skill-evals/next-phase-20260908/s4-evidence-reconciliation.json",
      "docs/validation/skill-evals/next-phase-20260908/s4-host-journey.json",
      "docs/validation/skill-evals/next-phase-20260908/s4-host-journey.md",
      "docs/validation/skill-evals/next-phase-20260908/s5-cli-help-verification.json",
      "docs/validation/skill-evals/next-phase-20260908/s5-consumer-journey.json",
      "docs/validation/skill-evals/next-phase-20260908/s5-consumer-journey.md",
      "docs/validation/skill-evals/next-phase-20260908/s5-historical-plan-verification.json",
      "docs/validation/skill-evals/next-phase-20260908/s5-historical-plan.md",
      "docs/validation/skill-evals/next-phase-20260908/s5-resume-journey.json",
      "docs/validation/skill-evals/next-phase-20260908/s5-resume.md",
      "docs/validation/skill-evals/next-phase-20260908/windows-ci-maintenance.json",
      "scripts/verify-installed-package.cjs",
      "skills/spec-handoff/SKILL.md",
      "skills/spec-handoff/evals/examples.json",
      "skills/spec-plan/SKILL.md",
      "skills/spec-plan/evals/examples.json",
      "skills/spec-plan/references/plan-sections.md",
      "skills/spec-runtime-setup/scripts/lib/host-authority.cjs",
      "skills/spec-work/SKILL.md",
      "skills/spec-work/evals/examples.json",
      "skills/spec-work/references/work-intake-and-task-pack.md",
      "skills/spec-write-tasks/SKILL.md",
      "src/cli/commands/clean.js",
      "src/cli/helpers/honest-closeout.js",
      "src/cli/helpers/verification-run-summary.js",
      "tests/integration/runtime-setup-graphify-hook-boundary.integration.test.js",
      "tests/unit/honest-closeout.test.js",
      "tests/unit/managed-removal-ownership.test.js",
      "tests/unit/spec-handoff-contracts.test.js",
      "tests/unit/spec-plan-contracts.test.js",
      "tests/unit/spec-work-contracts.test.js",
      "tests/unit/verification-run-summary.test.js",
      "tests/unit/verify-installed-package.test.js"
    ],
    "dirty_path_manifest_sha256": "33b61786960964e9410d7896334c5d74af7d9864197c34485c42c5e7682c5b73",
    "source_tree_hash": "31f6342f194db75c0a07343e4574b1311a30c907a02bfab9513fbd41a9c41985",
    "inventory_hash": "e45bd0fdd5d8d88fef13e0e50f2da78becc28d53ba639abc968a571f7f335063",
    "scope_contract": {
      "source_roots": [
        "CLAUDE.md",
        "AGENTS.md",
        "skills",
        "templates",
        "src",
        "scripts",
        "tests",
        "docs",
        "README.md",
        "README.en.md",
        "README.zh-CN.md",
        "CHANGELOG.md",
        "package.json"
      ],
      "excluded_run_outputs": [
        "docs/validation/2026-08-19-ce-post-3-20-full-window-name-status.md",
        "docs/validation/2026-08-19-ce-post-3-20-adjudication-input.json",
        "docs/validation/2026-08-19-ce-post-3-20-adjudication.json",
        "docs/validation/2026-08-19-ce-post-3-20-full-window-reconciliation-v2.json",
        "docs/validation/2026-08-19-ce-post-3-20-full-window-reconciliation-v2.md",
        "docs/validation/2026-08-19-spec-first-current-skill-package-inventory-v2.json",
        "docs/validation/2026-08-19-ce-post-3-20-evidence-exceptions.json",
        "docs/validation/2026-08-19-ce-post-3-20-ledger-patches/**",
        "docs/validation/ce-localization/**"
      ]
    },
    "hash_algorithm": {
      "name": "sha256",
      "version": "canonical-source-manifest-v1"
    }
  },
  "result_target_source_snapshot": {
    "repository": "spec-first",
    "head": "b557f8bc6f884f0fef460108e6279b31227c50fb",
    "dirty": true,
    "dirty_paths": [
      "CHANGELOG.md",
      "docs/contracts/verification/verification-run-summary.md",
      "docs/contracts/workflows/honest-closeout.md",
      "docs/plans/2026-09-05-001-next-phase-optimization-program-plan.md",
      "docs/plans/2026-09-05-002-next-phase-development-sequence.md",
      "docs/plans/2026-09-07-001-sdlc-lens-multi-expert-improvement-plan.md",
      "docs/validation/skill-evals/next-phase-20260908/README.md",
      "docs/validation/skill-evals/next-phase-20260908/accounting-correction.md",
      "docs/validation/skill-evals/next-phase-20260908/autonomous-closeout.json",
      "docs/validation/skill-evals/next-phase-20260908/autonomous-closeout.md",
      "docs/validation/skill-evals/next-phase-20260908/installed-and-integration.json",
      "docs/validation/skill-evals/next-phase-20260908/installed-and-integration.md",
      "docs/validation/skill-evals/next-phase-20260908/missing-e03-r7.json",
      "docs/validation/skill-evals/next-phase-20260908/s4-evidence-reconciliation.json",
      "docs/validation/skill-evals/next-phase-20260908/s4-host-journey.json",
      "docs/validation/skill-evals/next-phase-20260908/s4-host-journey.md",
      "docs/validation/skill-evals/next-phase-20260908/s5-cli-help-verification.json",
      "docs/validation/skill-evals/next-phase-20260908/s5-consumer-journey.json",
      "docs/validation/skill-evals/next-phase-20260908/s5-consumer-journey.md",
      "docs/validation/skill-evals/next-phase-20260908/s5-historical-plan-verification.json",
      "docs/validation/skill-evals/next-phase-20260908/s5-historical-plan.md",
      "docs/validation/skill-evals/next-phase-20260908/s5-resume-journey.json",
      "docs/validation/skill-evals/next-phase-20260908/s5-resume.md",
      "docs/validation/skill-evals/next-phase-20260908/windows-ci-maintenance.json",
      "scripts/verify-installed-package.cjs",
      "skills/spec-handoff/SKILL.md",
      "skills/spec-handoff/evals/examples.json",
      "skills/spec-plan/SKILL.md",
      "skills/spec-plan/evals/examples.json",
      "skills/spec-plan/references/plan-sections.md",
      "skills/spec-runtime-setup/scripts/lib/host-authority.cjs",
      "skills/spec-work/SKILL.md",
      "skills/spec-work/evals/examples.json",
      "skills/spec-work/references/work-intake-and-task-pack.md",
      "skills/spec-write-tasks/SKILL.md",
      "src/cli/commands/clean.js",
      "src/cli/helpers/honest-closeout.js",
      "src/cli/helpers/verification-run-summary.js",
      "tests/integration/runtime-setup-graphify-hook-boundary.integration.test.js",
      "tests/unit/honest-closeout.test.js",
      "tests/unit/managed-removal-ownership.test.js",
      "tests/unit/spec-handoff-contracts.test.js",
      "tests/unit/spec-plan-contracts.test.js",
      "tests/unit/spec-work-contracts.test.js",
      "tests/unit/verification-run-summary.test.js",
      "tests/unit/verify-installed-package.test.js"
    ],
    "dirty_path_manifest_sha256": "33b61786960964e9410d7896334c5d74af7d9864197c34485c42c5e7682c5b73",
    "source_tree_hash": "31f6342f194db75c0a07343e4574b1311a30c907a02bfab9513fbd41a9c41985",
    "inventory_hash": "e45bd0fdd5d8d88fef13e0e50f2da78becc28d53ba639abc968a571f7f335063",
    "scope_contract": {
      "source_roots": [
        "CLAUDE.md",
        "AGENTS.md",
        "skills",
        "templates",
        "src",
        "scripts",
        "tests",
        "docs",
        "README.md",
        "README.en.md",
        "README.zh-CN.md",
        "CHANGELOG.md",
        "package.json"
      ],
      "excluded_run_outputs": [
        "docs/validation/2026-08-19-ce-post-3-20-full-window-name-status.md",
        "docs/validation/2026-08-19-ce-post-3-20-adjudication-input.json",
        "docs/validation/2026-08-19-ce-post-3-20-adjudication.json",
        "docs/validation/2026-08-19-ce-post-3-20-full-window-reconciliation-v2.json",
        "docs/validation/2026-08-19-ce-post-3-20-full-window-reconciliation-v2.md",
        "docs/validation/2026-08-19-spec-first-current-skill-package-inventory-v2.json",
        "docs/validation/2026-08-19-ce-post-3-20-evidence-exceptions.json",
        "docs/validation/2026-08-19-ce-post-3-20-ledger-patches/**",
        "docs/validation/ce-localization/**"
      ]
    },
    "hash_algorithm": {
      "name": "sha256",
      "version": "canonical-source-manifest-v1"
    }
  },
  "affected_paths": [
    {
      "path": "skills/ce-brainstorm/SKILL.md",
      "unit_id": "U4",
      "changes": {
        "limitations": [
          "local source/test implementation is complete; independent fresh-source/runtime/field evidence remains unavailable or not-run",
          "owner receipt U4: source/test evidence recorded; independent fresh-source/runtime/field evidence remains bounded"
        ]
      }
    },
    {
      "path": "skills/ce-brainstorm/references/approaches.md",
      "unit_id": "U4",
      "changes": {
        "limitations": [
          "local source/test implementation is complete; independent fresh-source/runtime/field evidence remains unavailable or not-run",